{
    "name": "Devastating Weaponry",
    "type": "feat",
    "pfs": {
        "type": "stat_block_section",
        "subtype": "pfs",
        "availability": "Standard"
    },
    "sources": [
        {
            "type": "source",
            "name": "Guns & Gears",
            "link": {
                "type": "link",
                "name": "Guns & Gears pg. 31",
                "alt": "Guns & Gears pg. 31",
                "game-obj": "Sources",
                "aonid": 98
            },
            "page": 31,
            "errata": {
                "type": "link",
                "name": "2.0",
                "alt": "2.0",
                "game-obj": "Sources",
                "aonid": 98
            }
        }
    ],
    "aonid": 3085,
    "game-obj": "Feats",
    "feat": {
        "name": "Devastating Weaponry",
        "type": "stat_block_section",
        "subtype": "feat",
        "text": "You release a volley of projectiles from your weapon, or power it to fly in every direction across the battlefield and Strike multiple creatures. Make a Strike with your weapon innovation against each foe within 30 feet of you. Don't increase your multiple attack penalty until after making all the attacks. If your innovation is a melee weapon and any of the attacks are outside your reach, you Release the weapon before the Strikes, and it returns to your grasp after all of them. If your hands are full when the weapon returns, it falls to the ground in your space. As normal, if your weapon innovation requires one or more actions to reload between Strikes, you can't use it to make multiple attacks with Devastating Weaponry.",
        "level": 18,
        "action_type": {
            "type": "stat_block_section",
            "subtype": "action_type",
            "name": "Three Actions"
        },
        "traits": [
            {
                "name": "Inventor",
                "type": "trait",
                "edition": "remastered",
                "sources": [
                    {
                        "type": "source",
                        "name": "Guns & Gears",
                        "link": {
                            "type": "link",
                            "name": "Guns & Gears pg. 233",
                            "alt": "Guns & Gears pg. 233",
                            "game-obj": "Sources",
                            "aonid": 98
                        },
                        "page": 233,
                        "errata": {
                            "type": "link",
                            "name": "2.0",
                            "alt": "2.0",
                            "game-obj": "Sources",
                            "aonid": 98
                        }
                    }
                ],
                "game-obj": "Traits",
                "game-id": "e5ab633748d8347d034849e5059d76ab",
                "text": "This indicates abilities from the inventor class.",
                "links": [
                    {
                        "type": "link",
                        "name": "inventor",
                        "alt": "inventor",
                        "game-obj": "Classes",
                        "aonid": 19
                    }
                ]
            }
        ],
        "prerequisite": "*weapon innovation*",
        "links": [
            {
                "type": "link",
                "name": "reload",
                "alt": "reload",
                "game-obj": "Traits",
                "aonid": 254
            },
            {
                "type": "link",
                "name": "weapon innovation",
                "alt": "weapon innovation",
                "game-obj": "Innovations",
                "aonid": 3
            }
        ]
    },
    "edition": "remastered",
    "game-id": "d8fd63b326367db8b2dda99d0bea4ead",
    "license": {
        "name": "ORC Notice",
        "type": "section",
        "sections": [
            {
                "name": "Attribution",
                "type": "section",
                "text": "This product is based on the following Licensed Material:",
                "sections": [
                    {
                        "name": "Guns & Gears",
                        "type": "section",
                        "text": "***Pathfinder Core Rulebook (Second Edition)*** \u00a9 2019, Paizo Inc.; Authors: Logan Bonner, Jason Bulmahn, Stephen Radney-MacFarland, and Mark Seifter.  \n ***Pathfinder Guns & Gears*** \u00a9 2021, Paizo Inc.; Authors: Logan Bonner, Jessica Catalan, John Compton, Andrew D. Geels, Steven Hammond, Sen H.H.S., Brent Holtsberry, Jason Keeley, Dustin Knight, Luis Loza, Ron Lundeen, Chris Mastey, Liane Merciel, Jacob W. Michaels, Dave Nelson, Samantha Phelan, Mikhail Rekun, Stephen Radney-MacFarland, Sydney Meeker, Kendra Leigh Speedling, Michael Sayre., Mark Seifter, Andrew Stoeckle, Calliope Lee Taylor, Andrew White, and Scott D. Young."
                    }
                ]
            },
            {
                "name": "Attributing us",
                "type": "section",
                "text": "If you use our Licensed Material in your own published works, please credit us as follows:",
                "sections": [
                    {
                        "name": "Pathfinder Open Reference",
                        "type": "section",
                        "text": "\u00a9 2023 Masterwork Tools LLC, Authors: Devon Jones, Monica Jones."
                    }
                ]
            },
            {
                "name": "Reserved Material",
                "type": "section",
                "text": "Reserved Material elements in this product include, but may not be limited to: [none]"
            },
            {
                "name": "Expressly Designated Licensed Material",
                "type": "section",
                "text": "The following elements are owned by the Licensor and would otherwise constitute Reserved Material and are hereby designated as Licensed Material: [None]."
            }
        ],
        "subtype": "license",
        "license": "Open RPG Creative license",
        "text": "This product is licensed under the ORC License to be held in the Library of Congress and available online at various locations including paizo.com/orclicense, azoralaw.com/orclicense, and others. All warranties are disclaimed as set forth therein."
    },
    "schema_version": 1.0
}