{
  "aonid": 5330,
  "edition": "remastered",
  "feat": {
    "level": 5,
    "links": [
      {
        "alt": "bless",
        "aonid": 1451,
        "game-obj": "Spells",
        "name": "bless",
        "type": "link"
      },
      {
        "alt": "fleet step",
        "aonid": 1531,
        "game-obj": "Spells",
        "name": "fleet step",
        "type": "link"
      },
      {
        "alt": "Budding Speaker Centaur",
        "aonid": 292,
        "game-obj": "Heritages",
        "name": "Budding Speaker Centaur",
        "type": "link"
      }
    ],
    "name": "Speaker in Training",
    "prerequisite": "*Budding Speaker Centaur*, or the ability to cast a divine or primal spell",
    "subtype": "feat",
    "text": "You've begun your training as a Speaker. Select divine or primal. If you selected divine, you're a Faithspeaker. If you selected primal, you're a Greenspeaker. If you've already made this decision (such as due to being a budding speaker) you must select the same Speaker you previously chose. This choice can't be changed. If you're a Faithspeaker, you can cast *bless* once per day as a divine innate spell; if you're a Greenspeaker, you can cast *fleet step* once per day as a primal innate spell.",
    "traits": [
      {
        "edition": "remastered",
        "game-id": "9a500f60cf6f1b2c699642751076425e",
        "game-obj": "Traits",
        "name": "Centaur",
        "sources": [
          {
            "errata": {
              "alt": "1.1",
              "aonid": 221,
              "game-obj": "Sources",
              "name": "1.1",
              "type": "link"
            },
            "link": {
              "alt": "Monster Core pg. 362",
              "aonid": 221,
              "game-obj": "Sources",
              "name": "Monster Core pg. 362",
              "type": "link"
            },
            "name": "Monster Core",
            "page": 362,
            "type": "source"
          }
        ],
        "text": "Centaurs have humanoid upper bodies and equine lower bodies.",
        "type": "trait"
      }
    ],
    "type": "stat_block_section"
  },
  "game-id": "b63d2cce877e441b3526f149c58eba11",
  "game-obj": "Feats",
  "license": {
    "license": "Open RPG Creative license",
    "name": "ORC Notice",
    "sections": [
      {
        "name": "Attribution",
        "sections": [
          {
            "name": "Howl of the Wild",
            "text": "***Pathfinder Howl of the Wild*** \u00a9 2024 Paizo Inc. Authors: Kate Baker, Joshua Birdsong, Rigby Bendele, Chris Bissette, Jeremy Blum, Logan Bonner, Dan Cascone, James Case, Jessica Catalan, Brite Cheney, Rue Dickey, Caryn DiMarco, Matthew Fu, Leo Glass, Steven Hammond, Patrick Hurley, Michelle Y. Kim, Dustin Knight, Kendra Leigh Speedling, Christiana Lewis, Jessie \u201cAki\u201d Lo, Luis Loza, Letterio Mammoliti, Jonathan \u201cRyomasa\u201d Mendoza, Quinn Murphy, Dave Nelson, Mikhail Rekun, Kai Revius, Ember Rose, Simone D. Sall\u00e9, Michael Sayre, Shay Snow, Levi Steadman, Kyle Tam, Ruvaid Virk, and Andrew White",
            "type": "section"
          }
        ],
        "text": "This product is based on the following Licensed Material:",
        "type": "section"
      },
      {
        "name": "Attributing us",
        "sections": [
          {
            "name": "Pathfinder Open Reference",
            "text": "\u00a9 2023 Masterwork Tools LLC, Authors: Devon Jones, Monica Jones.",
            "type": "section"
          }
        ],
        "text": "If you use our Licensed Material in your own published works, please credit us as follows:",
        "type": "section"
      },
      {
        "name": "Reserved Material",
        "text": "Reserved Material elements in this product include, but may not be limited to: [none]",
        "type": "section"
      },
      {
        "name": "Expressly Designated Licensed Material",
        "text": "The following elements are owned by the Licensor and would otherwise constitute Reserved Material and are hereby designated as Licensed Material: [None].",
        "type": "section"
      }
    ],
    "subtype": "license",
    "text": "This product is licensed under the ORC License to be held in the Library of Congress and available online at various locations including paizo.com/orclicense, azoralaw.com/orclicense, and others. All warranties are disclaimed as set forth therein.",
    "type": "section"
  },
  "name": "Speaker in Training",
  "pfs": {
    "availability": "Standard",
    "subtype": "pfs",
    "type": "stat_block_section"
  },
  "schema_version": 1.0,
  "sections": [
    {
      "links": [
        {
          "alt": "Merge with the Source",
          "aonid": 5341,
          "game-obj": "Feats",
          "name": "Merge with the Source",
          "type": "link"
        },
        {
          "alt": "Speaker's Defense",
          "aonid": 5335,
          "game-obj": "Feats",
          "name": "Speaker's Defense",
          "type": "link"
        }
      ],
      "name": "Speaker in Training Leads To...",
      "sources": [
        {
          "errata": {
            "alt": "2.1",
            "aonid": 226,
            "game-obj": "Sources",
            "name": "2.1",
            "type": "link"
          },
          "link": {
            "alt": "Howl of the Wild pg. 32",
            "aonid": 226,
            "game-obj": "Sources",
            "name": "Howl of the Wild pg. 32",
            "type": "link"
          },
          "name": "Howl of the Wild",
          "page": 32,
          "type": "source"
        }
      ],
      "text": "*Merge with the Source*, *Speaker's Defense*",
      "type": "section"
    }
  ],
  "sources": [
    {
      "errata": {
        "alt": "2.1",
        "aonid": 226,
        "game-obj": "Sources",
        "name": "2.1",
        "type": "link"
      },
      "link": {
        "alt": "Howl of the Wild pg. 32",
        "aonid": 226,
        "game-obj": "Sources",
        "name": "Howl of the Wild pg. 32",
        "type": "link"
      },
      "name": "Howl of the Wild",
      "page": 32,
      "type": "source"
    }
  ],
  "type": "feat"
}