{
    "name": "Instant Return",
    "type": "feat",
    "pfs": {
        "type": "stat_block_section",
        "subtype": "pfs",
        "availability": "Standard"
    },
    "sources": [
        {
            "type": "source",
            "name": "Guns & Gears",
            "link": {
                "type": "link",
                "name": "Guns & Gears pg. 119",
                "alt": "Guns & Gears pg. 119",
                "game-obj": "Sources",
                "aonid": 98
            },
            "page": 119,
            "errata": {
                "type": "link",
                "name": "2.0",
                "alt": "2.0",
                "game-obj": "Sources",
                "aonid": 98
            }
        }
    ],
    "aonid": 3206,
    "game-obj": "Feats",
    "feat": {
        "name": "Instant Return",
        "type": "stat_block_section",
        "subtype": "feat",
        "text": "With a single fluid gesture, you catch a projectile out of the air, load it in your weapon, and shoot it back at the attacker. Interact to load the projectile into your weapon, then make a Strike with the required weapon against the triggering opponent. Since you're using the foe's ammunition, this Strike applies any special effects that ammunition would have (for instance, if it was *explosive ammunition*, it would explode in a burst of fire if your Strike hits).",
        "level": 16,
        "action_type": {
            "type": "stat_block_section",
            "subtype": "action_type",
            "name": "Reaction"
        },
        "traits": [
            {
                "name": "Gunslinger",
                "type": "trait",
                "edition": "remastered",
                "sources": [
                    {
                        "type": "source",
                        "name": "Guns & Gears",
                        "link": {
                            "type": "link",
                            "name": "Guns & Gears pg. 233",
                            "alt": "Guns & Gears pg. 233",
                            "game-obj": "Sources",
                            "aonid": 98
                        },
                        "page": 233,
                        "errata": {
                            "type": "link",
                            "name": "2.0",
                            "alt": "2.0",
                            "game-obj": "Sources",
                            "aonid": 98
                        }
                    }
                ],
                "game-obj": "Traits",
                "game-id": "77b5d572a82ea7d7ea5e50c88690d335",
                "text": "This indicates abilities from the gunslinger class.",
                "links": [
                    {
                        "type": "link",
                        "name": "gunslinger",
                        "alt": "gunslinger",
                        "game-obj": "Classes",
                        "aonid": 20
                    }
                ]
            }
        ],
        "trigger": "An enemy misses you with a ranged attack using a type of ammunition appropriate to your weapon (a bullet if you're wielding a firearm).",
        "requirement": "You're wielding an unloaded firearm or crossbow.",
        "links": [
            {
                "type": "link",
                "name": "explosive ammunition",
                "alt": "explosive ammunition",
                "game-obj": "Equipment",
                "aonid": 162
            }
        ]
    },
    "edition": "remastered",
    "game-id": "b1e9959e5609a4fa2d3142cd07b91e7d",
    "license": {
        "name": "ORC Notice",
        "type": "section",
        "sections": [
            {
                "name": "Attribution",
                "type": "section",
                "text": "This product is based on the following Licensed Material:",
                "sections": [
                    {
                        "name": "Guns & Gears",
                        "type": "section",
                        "text": "***Pathfinder Core Rulebook (Second Edition)*** \u00a9 2019, Paizo Inc.; Authors: Logan Bonner, Jason Bulmahn, Stephen Radney-MacFarland, and Mark Seifter.  \n ***Pathfinder Guns & Gears*** \u00a9 2021, Paizo Inc.; Authors: Logan Bonner, Jessica Catalan, John Compton, Andrew D. Geels, Steven Hammond, Sen H.H.S., Brent Holtsberry, Jason Keeley, Dustin Knight, Luis Loza, Ron Lundeen, Chris Mastey, Liane Merciel, Jacob W. Michaels, Dave Nelson, Samantha Phelan, Mikhail Rekun, Stephen Radney-MacFarland, Sydney Meeker, Kendra Leigh Speedling, Michael Sayre., Mark Seifter, Andrew Stoeckle, Calliope Lee Taylor, Andrew White, and Scott D. Young."
                    }
                ]
            },
            {
                "name": "Attributing us",
                "type": "section",
                "text": "If you use our Licensed Material in your own published works, please credit us as follows:",
                "sections": [
                    {
                        "name": "Pathfinder Open Reference",
                        "type": "section",
                        "text": "\u00a9 2023 Masterwork Tools LLC, Authors: Devon Jones, Monica Jones."
                    }
                ]
            },
            {
                "name": "Reserved Material",
                "type": "section",
                "text": "Reserved Material elements in this product include, but may not be limited to: [none]"
            },
            {
                "name": "Expressly Designated Licensed Material",
                "type": "section",
                "text": "The following elements are owned by the Licensor and would otherwise constitute Reserved Material and are hereby designated as Licensed Material: [None]."
            }
        ],
        "subtype": "license",
        "license": "Open RPG Creative license",
        "text": "This product is licensed under the ORC License to be held in the Library of Congress and available online at various locations including paizo.com/orclicense, azoralaw.com/orclicense, and others. All warranties are disclaimed as set forth therein."
    },
    "schema_version": 1.0
}